{
  "$schema": "http://json-schema.org/draft-07/schema#",
  "$id": "https://opencode.ai/schemas/subagent-config.json",
  "title": "Subagent Configuration Schema",
  "description": "Schema for opencode subagent configuration files",
  "type": "object",
  "required": [
    "$schema",
    "description",
    "mode",
    "tools",
    "permissions",
    "environment",
    "behavior",
    "specialization"
  ],
  "properties": {
    "$schema": {
      "type": "string",
      "description": "JSON Schema reference"
    },
    "description": {
      "type": "string",
      "description": "Human-readable description of the subagent"
    },
    "mode": {
      "type": "string",
      "enum": ["subagent"],
      "description": "Agent mode (must be subagent)"
    },
    "tools": {
      "type": "object",
      "description": "Available tools for the subagent",
      "properties": {
        "read": { "type": "boolean" },
        "write": { "type": "boolean" },
        "edit": { "type": "boolean" },
        "bash": { "type": "boolean" },
        "webfetch": { "type": "boolean" },
        "grep": { "type": "boolean" },
        "glob": { "type": "boolean" },
        "list": { "type": "boolean" },
        "patch": { "type": "boolean" },
        "todowrite": { "type": "boolean" },
        "todoread": { "type": "boolean" }
      },
      "additionalProperties": false
    },
    "permissions": {
      "type": "object",
      "description": "Subagent permissions",
      "properties": {
        "read": { "type": "boolean" },
        "write": { "type": "boolean" },
        "execute": { "type": "boolean" },
        "admin": { "type": "boolean" }
      },
      "additionalProperties": false
    },
    "environment": {
      "type": "object",
      "description": "Environment variables for the subagent"
    },
    "behavior": {
      "type": "object",
      "description": "Behavior configuration"
    },
    "specialization": {
      "type": "object",
      "description": "Subagent specialization details",
      "required": ["domain", "framework", "capabilities"],
      "properties": {
        "domain": {
          "type": "string",
          "description": "Domain of specialization"
        },
        "framework": {
          "type": "string",
          "description": "Framework specialization"
        },
        "capabilities": {
          "type": "array",
          "description": "List of capabilities"
        },
        "required_skills": {
          "type": "array",
          "description": "List of Agent Skills this subagent requires (optional)"
        }
      },
      "additionalProperties": false
    }
  },
  "additionalProperties": false
}
