{
  "$schema": "../../schemas/subagent-config.json",
  "description": "Specialized agent for :cody build workflows with full development capabilities",
  "mode": "subagent",
  "tools": {
    "read": true,
    "write": true,
    "edit": true,
    "bash": true,
    "webfetch": true,
    "grep": true,
    "glob": true,
    "list": true,
    "patch": true,
    "todowrite": true,
    "todoread": true
  },
  "permissions": {
    "read": true,
    "write": true,
    "execute": true
  },
  "environment": {
    "CODY_MODE": "builder",
    "OPENCODE_CONTEXT": "cody-building"
  },
  "behavior": {
    "conservative": false,
    "confirmation_required": false,
    "context_preservation": true,
    "rollback_enabled": true,
    "auto_advance_versions": true,
    "feature_backlog_aware": true
  },
  "specialization": {
    "domain": "software-development",
    "framework": "cody",
    "capabilities": [
      "code-generation",
      "build-automation",
      "testing-implementation",
      "documentation-creation",
      "deployment-preparation",
      "version-management",
      "feature-backlog-analysis",
      "workflow-automation"
    ]
  }
}